{
  "schemaVersion": "phase9.active-objective-pointer.v1",
  "objectiveId": "OBJ-2026-04-22-001",
  "objectiveRecordPath": ".vibe-science-environment/objectives/OBJ-2026-04-22-001/objective.json",
  "lockAcquiredAt": "2026-04-22T20:16:00Z",
  "lockAcquiredBySession": "sess-2026-04-22-night",
  "currentWakeLease": {
    "wakeId": null,
    "leaseAcquiredAt": null,
    "leaseExpiresAt": null,
    "acquiredBy": null,
    "previousWakeId": null
  }
}
